Location,Job Title,Salary Estimate,Employer Name,Job Description,Rating,Company Size,Founded,Type,Industry,Sector,Revenue
Remote,Data Analyst,$50.00 - $75.00 Per Hour (Employer est.),Key Process Partners,"Description: Key Process Partners (KPP) is seeking a data analyst to help our clients with their data and reporting projects and tasks. KPP is a consulting company that helps companies reach their ambitious growth goals by improving their internal processes. We do this primarily through creating structure and operational processes to streamline their organization so they can grow and scale efficiently. KPP is looking to hire someone with experience using UiPath (RPA robotic process automation software). We will be making data updates for clients who are using PestPac software on a project-by-project basis, and are looking to automate the data updates using UiPath. Our ideal candidate also has advanced skills in Microsoft Excel so they can also assist on a recurring (monthly) basis with clients’ routine reporting needs. The pay range for this position is $50-$75 per hour. The position is 100% remote (work from anywhere). This is a part-time position as a W-2 employee (not a 1099 contractor), between 0 and 10 hours per week (5-25 hours per month). Depending on the project schedules and the volume of clients being supported, some weeks there may be 10+ hours of work and other weeks may have 0-2 hours of work. This role would be great for someone who is looking for part-time work with a flexible schedule. Your role would have responsibilities that are both project-based (as needed) and routine/recurring. Most of the work can be completed at any time (during traditional work hours or outside of traditional work hours), though most of the project work would need to be completed on weekends to avoid end-user interruption.  Job Duties would include: Perform large data updates using UiPath (robotic process automation software) (5-20 hours per month) Review data sets in Microsoft Excel such as customer revenue, employee hours worked, customer demographics, marketing KPIs, financial/accounting records, etc. and create Pivot Tables, dashboards, and other reporting for management review (1-2 hours per week) Create custom reports (including logic and formulas) and dashboards using Exago software (2-4 hours per month) Review data sets to look for trends or other variances (1-2 hours per month) Our ideal candidate has advanced skills in logic, math, formulas, and Microsoft Excel. You are very analytical-you like solving puzzles and looking for not just any solution but the most efficient solution. You like optimizing processes and making the overall experience better for all those involved.  Key Process Partners helps clients with their internal business processes to help them grow and scale their business to reach their ambitious growth goals. KPP has a mission to create wealth for women and minorities, and we especially love working with clients who are women-owned businesses or minority-owned businesses, and/or those that support our values of diversity, equity, inclusion, and belonging. Benefits: Flexible work schedule Direct Deposit Pay day on the 7th and 22nd of the month Paylocity payroll system Hiring Process: Phone Interview (10-15 minutes) Virtual Interview (60 minutes) Candidate personality assessments (online) Demonstration of skills competencies via Video Call/screenshare (30-60 minutes) Job Offer Background check Reference checks Requirements: Availability to work on weekends (Saturday or Sunday) Advanced Microsoft Excel skills, including Pivot Tables and complex formulas (Nested if statements, multi-criteria conditional formatting, etc.) required 2+ years’ experience with UiPath (https://www.UiPath.com/) required 2+ years’ experience with Exago (https://insightsoftware.com/logi-analytics/) preferred 2+ years’ experience with PestPac Report Writer (https://www.pestpac.com/) preferred Key Process Partners (KPP) is seeking a data analyst to help our clients with their data and reporting projects and tasks. KPP is a consulting company that helps companies reach their ambitious growth goals by improving their internal processes. We do this primarily through creating structure and operational processes to streamline their organization so they can grow and scale efficiently. KPP is looking to hire someone with experience using UiPath (RPA robotic process automation software). We will be making data updates for clients who are using PestPac software on a project-by-project basis, and are looking to automate the data updates using UiPath. Our ideal candidate also has advanced skills in Microsoft Excel so they can also assist on a recurring (monthly) basis with clients’ routine reporting needs. The pay range for this position is $50-$75 per hour. The position is 100% remote (work from anywhere). $50-$75 per hour 100% remote This is a part-time position as a W-2 employee (not a 1099 contractor), between 0 and 10 hours per week (5-25 hours per month). Depending on the project schedules and the volume of clients being supported, some weeks there may be 10+ hours of work and other weeks may have 0-2 hours of work. This role would be great for someone who is looking for part-time work with a flexible schedule. Your role would have responsibilities that are both project-based (as needed) and routine/recurring. Most of the work can be completed at any time (during traditional work hours or outside of traditional work hours), though most of the project work would need to be completed on weekends to avoid end-user interruption. part-time 0 and 10 hours per week (5-25 hours per month) Job Duties would include: Perform large data updates using UiPath (robotic process automation software) (5-20 hours per month) Review data sets in Microsoft Excel such as customer revenue, employee hours worked, customer demographics, marketing KPIs, financial/accounting records, etc. and create Pivot Tables, dashboards, and other reporting for management review (1-2 hours per week) Create custom reports (including logic and formulas) and dashboards using Exago software (2-4 hours per month) Review data sets to look for trends or other variances (1-2 hours per month) Perform large data updates using UiPath (robotic process automation software) (5-20 hours per month) Review data sets in Microsoft Excel such as customer revenue, employee hours worked, customer demographics, marketing KPIs, financial/accounting records, etc. and create Pivot Tables, dashboards, and other reporting for management review (1-2 hours per week) Create custom reports (including logic and formulas) and dashboards using Exago software (2-4 hours per month) Review data sets to look for trends or other variances (1-2 hours per month) Our ideal candidate has advanced skills in logic, math, formulas, and Microsoft Excel. You are very analytical-you like solving puzzles and looking for not just any solution but the most efficient solution. You like optimizing processes and making the overall experience better for all those involved. Key Process Partners helps clients with their internal business processes to help them grow and scale their business to reach their ambitious growth goals. KPP has a mission to create wealth for women and minorities, and we especially love working with clients who are women-owned businesses or minority-owned businesses, and/or those that support our values of diversity, equity, inclusion, and belonging. Benefits: Flexible work schedule Direct Deposit Pay day on the 7th and 22nd of the month Paylocity payroll system Flexible work schedule Direct Deposit Pay day on the 7th and 22nd of the month Paylocity payroll system Hiring Process: Phone Interview (10-15 minutes) Virtual Interview (60 minutes) Candidate personality assessments (online) Demonstration of skills competencies via Video Call/screenshare (30-60 minutes) Job Offer Background check Reference checks Phone Interview (10-15 minutes) Virtual Interview (60 minutes) Candidate personality assessments (online) Demonstration of skills competencies via Video Call/screenshare (30-60 minutes) Job Offer Background check Reference checks Availability to work on weekends (Saturday or Sunday) Advanced Microsoft Excel skills, including Pivot Tables and complex formulas (Nested if statements, multi-criteria conditional formatting, etc.) required 2+ years’ experience with UiPath (https://www.UiPath.com/) required 2+ years’ experience with Exago (https://insightsoftware.com/logi-analytics/) preferred 2+ years’ experience with PestPac Report Writer (https://www.pestpac.com/) preferred Availability to work on weekends (Saturday or Sunday) Advanced Microsoft Excel skills, including Pivot Tables and complex formulas (Nested if statements, multi-criteria conditional formatting, etc.) required 2+ years’ experience with UiPath (https://www.UiPath.com/) required 2+ years’ experience with Exago (https://insightsoftware.com/logi-analytics/) preferred 2+ years’ experience with PestPac Report Writer (https://www.pestpac.com/) preferred",N/A,1 to 50 Employees,N/A,Company - Private,N/A,N/A,Unknown / Non-Applicable
"Pleasant Hill, CA",Data Analyst,$33.00 - $34.00 Per Hour (Employer est.),Special Olympics of Northern California,"Job Title: Data Analyst Job Title: Data Analyst Reports To: Sr. Director of IT Reports To: Sr. Director of IT Office Location: Pleasant Hill, CA Office Location: Pleasant Hill, CA FLSA: Hourly, full-time, Non-Exempt - benefits eligible FLSA: Hourly, full-time, Non-Exempt - benefits eligible Special Olympics Northern California's (SONC) mission is to create an inclusive community where people with and without disabilities can make connections, develop healthy lifestyles, achieve success, and experience the joy of sports. Position Summary: Position Summary: ** We are interested in every qualified candidate eligible to work in the United States, but are not able to sponsor visas at this time ** ** We are interested in every qualified candidate eligible to work in the United States, but are not able to sponsor visas at this time ** As the organization’s first Data Analyst, this person will be responsible for creating a culture of shared and useful data across the organization. Special Olympics Northern California needs include the gathering, analyzing, aggregating, and reporting on data across the entire CRM Environment. Senior leadership will rely on this position to extract meaningful data-driven insights and present findings to them for use in helping solve key business problems. The position will be tasked with working with staff across multiple departments to create and maintain reporting and dashboards within the organization’s systems including Salesforce, Blackbaud Financial Edge, Microsoft O365, Google Sheets, UpMetrics, and peer-to-peer fundraising tools. This position must be able to use the organization’s existing tools and systems to help advance us toward a data-centric organization. Responsibilities/ Essential Functions: Responsibilities/ Essential Functions: Responsible for leading the analysis (including collection and cleaning) of data across the Special Olympics Northern CA data landscape. Maintaining data systems and databases; this includes identifying and fixing errors and other data-related issues. Mining data from primary and secondary sources, then reorganizing said data in a format that can be easily understood. Managing and analyzing qualitative and quantitative metrics to measure progress across key strategic areas. Work in conjunction with the Sr. Director of IT and a Salesforce database manager to create appropriate scope and procedures for data capture in all areas of the organization. Work in conjunction with IT Sr. Director to ensure continued data quality. Helping staff interpret data with attention to trends and patterns that may be valuable for future organizational efforts. Developing reports for leadership that effectively communicates trends, patterns, and predictions. Collaborating with department heads to identify opportunities for improvement, recommend modifications, and develop guidelines for data governance. Help managers to understand and craft metrics, track approaches, and answer their questions. Occasionally presenting to management the “state of data” in the organization. Creating a documentation and reporting structure for the organization. Other needs as identified. Responsible for leading the analysis (including collection and cleaning) of data across the Special Olympics Northern CA data landscape. Maintaining data systems and databases; this includes identifying and fixing errors and other data-related issues. Mining data from primary and secondary sources, then reorganizing said data in a format that can be easily understood. Managing and analyzing qualitative and quantitative metrics to measure progress across key strategic areas. Work in conjunction with the Sr. Director of IT and a Salesforce database manager to create appropriate scope and procedures for data capture in all areas of the organization. Work in conjunction with IT Sr. Director to ensure continued data quality. Helping staff interpret data with attention to trends and patterns that may be valuable for future organizational efforts. Developing reports for leadership that effectively communicates trends, patterns, and predictions. Collaborating with department heads to identify opportunities for improvement, recommend modifications, and develop guidelines for data governance. Help managers to understand and craft metrics, track approaches, and answer their questions. Occasionally presenting to management the “state of data” in the organization. Creating a documentation and reporting structure for the organization. Other needs as identified. Qualifications, Skills & Experiences: Qualifications, Skills & Experiences: BS Degree in Computer Science, Math or Business At least three years’ experience in an equivalent position Technical skills include: BS Degree in Computer Science, Math or Business At least three years’ experience in an equivalent position Technical skills include: o Strong experience with Salesforce (preferably NPSP) and a must in Report/Dashboard development and data hygiene o SQL (SaaS Azure environment) o Spreadsheet tools such as Microsoft Excel, SharePoint, and Power BI o Experience with the Google Docs environment o Data visualization software; UpMetrics is a plus o Mathematical and statistical skills. Experience working with a non-profit organization Project Management Experience Provide end-user training and orientation on systems. Above average communications skills, both oral and written Comfortable with learning and using new software programs. Ability to develop and maintain effective working relationships. Ability to manage one’s time effectively – to prioritize and to complete diverse assignments concurrently when working on a deadline. Ability to work independently. Flexibility - managing competing demands and adapting to changes in the work environment. Commitment to excellence Experience working with a non-profit organization Project Management Experience Provide end-user training and orientation on systems. Above average communications skills, both oral and written Comfortable with learning and using new software programs. Ability to develop and maintain effective working relationships. Ability to manage one’s time effectively – to prioritize and to complete diverse assignments concurrently when working on a deadline. Ability to work independently. Flexibility - managing competing demands and adapting to changes in the work environment. Commitment to excellence Benefits include, but are not limited to: Medical, Dental, Vision, 403(b) retirement plan, life and long-term disability insurance, vacation, sick and personal days, federal holidays, and a paid winter break. This position allows for a hybrid work environment. Special Olympics Northern California is an Equal Opportunity Employer and does not discriminate against any employee or applicant for employment because of race, color, ethnic background, religion, gender identity, gender expression, sexual orientation, age, national origin, or disabilities. Auxiliary aids and services are available upon request to individuals with disabilities; please let us know if you need accommodation for the interview process. We encourage applications from all qualified candidates, including those with diverse backgrounds. Special Olympics Northern California is an Equal Opportunity Employer and does not discriminate against any employee or applicant for employment because of race, color, ethnic background, religion, gender identity, gender expression, sexual orientation, age, national origin, or disabilities. Auxiliary aids and services are available upon request to individuals with disabilities; please let us know if you need accommodation for the interview process. We encourage applications from all qualified candidates, including those with diverse backgrounds. Job Type: Full-time Pay: $33.00 - $34.00 per hour Experience level: 3 years 3 years Schedule: 8 hour shift 8 hour shift Application Question(s): Do you have any experience with Salesforce? How many years? Do you experience with MS Azure specifically Azure SQL as an Service? How many years? Do you have any experience with Salesforce? How many years? Do you experience with MS Azure specifically Azure SQL as an Service? How many years? Work Location: Hybrid remote in Pleasant Hill, CA 94523",3.8,201 to 500 Employees,1968,Nonprofit Organization,Civic & Social Services,Nonprofit & NGO,$100 to $500 million (USD)
Remote,Data Analyst,N/A,Uscreen,"LOCATION: Remote What are we doing at Uscreen? Uscreen is a growing (and profitable) bootstrapped product-led SaaS business revolutionizing the way that video-based entrepreneurs & creators monetize their content. Uscreen provides an all-in-one video membership platform. We empower video-based entrepreneurs to monetize subscriptions, communities, courses, and live-streamed events across platforms (web, mobile, & TV). 25,000+ video creators sell, market, manage, & grow their businesses with Uscreen — and they generate hundreds of millions of dollars in revenue doing it.  As a Data Analyst, you will be an integral part of our Analytics team. This is a unique experience in that you’ll drive key insights into the actionable metrics that help our customers build stronger membership businesses. As such, you’ll partner closely with leaders on our Customer Success and Product Marketing teams to help our customers get the most out of our platform. You’ll excel in this role if you’re comfortable with communication, enjoy experimentation, have strong attention to detail, and are excited by the prospect of working cross-functionally. You’ll be joining a growing and versatile Analytics team, so we’re looking for teammates eager to explore new areas and support different parts of our company as our team priorities and contributions to the business evolve. What you’ll do Analyze user data to identify trends, patterns, and insights that can help us improve user retention and support Develop dashboards and reports that provide insights into key performance metrics on the health of our customers’ businesses Collaborate with Product Marketing on building a better understanding of our customer segments and understanding the needs of the growth creators that our product supports Effectively and clearly present findings and recommendations to both senior company stakeholders and customers, and provide guidance on how to leverage data to drive business growth Do you have what it takes? Post-secondary degree in a relevant field such as: Statistics, Mathematics, Computer Science 3+ years of experience in data analytics, preferably in a customer-facing role Strong analytical skills with experience in data analysis, data visualization, and reporting Experience with analyzing complex datasets using SQL Experience with data storytelling and building dashboards on business intelligence platforms such as Metabase or Looker Familiarity with our Analytics tech stack (dbt, BigQuery, Metabase) a plus Excellent communication and presentation skills, with the ability to explain technical concepts to non-technical stakeholders including Uscreen customers Strong problem-solving skills and attention to detail ✔️ Are you interested in applying? Fill out the short form We will review the applications and email candidates who qualify to set up a first-round interview LOCATION: Remote What are we doing at Uscreen? What are we doing at Uscreen? Uscreen is a growing (and profitable) bootstrapped product-led SaaS business revolutionizing the way that video-based entrepreneurs & creators monetize their content. Uscreen provides an all-in-one video membership platform. We empower video-based entrepreneurs to monetize subscriptions, communities, courses, and live-streamed events across platforms (web, mobile, & TV). 25,000+ video creators sell, market, manage, & grow their businesses with Uscreen — and they generate hundreds of millions of dollars in revenue doing it.  As a Data Analyst, you will be an integral part of our Analytics team. This is a unique experience in that you’ll drive key insights into the actionable metrics that help our customers build stronger membership businesses. As such, you’ll partner closely with leaders on our Customer Success and Product Marketing teams to help our customers get the most out of our platform. You’ll excel in this role if you’re comfortable with communication, enjoy experimentation, have strong attention to detail, and are excited by the prospect of working cross-functionally. You’ll be joining a growing and versatile Analytics team, so we’re looking for teammates eager to explore new areas and support different parts of our company as our team priorities and contributions to the business evolve. What you’ll do What you’ll do Analyze user data to identify trends, patterns, and insights that can help us improve user retention and support Develop dashboards and reports that provide insights into key performance metrics on the health of our customers’ businesses Collaborate with Product Marketing on building a better understanding of our customer segments and understanding the needs of the growth creators that our product supports Effectively and clearly present findings and recommendations to both senior company stakeholders and customers, and provide guidance on how to leverage data to drive business growth Analyze user data to identify trends, patterns, and insights that can help us improve user retention and support Develop dashboards and reports that provide insights into key performance metrics on the health of our customers’ businesses Collaborate with Product Marketing on building a better understanding of our customer segments and understanding the needs of the growth creators that our product supports Effectively and clearly present findings and recommendations to both senior company stakeholders and customers, and provide guidance on how to leverage data to drive business growth Do you have what it takes? Do you have what it takes? Post-secondary degree in a relevant field such as: Statistics, Mathematics, Computer Science 3+ years of experience in data analytics, preferably in a customer-facing role Strong analytical skills with experience in data analysis, data visualization, and reporting Experience with analyzing complex datasets using SQL Experience with data storytelling and building dashboards on business intelligence platforms such as Metabase or Looker Familiarity with our Analytics tech stack (dbt, BigQuery, Metabase) a plus Excellent communication and presentation skills, with the ability to explain technical concepts to non-technical stakeholders including Uscreen customers Strong problem-solving skills and attention to detail Post-secondary degree in a relevant field such as: Statistics, Mathematics, Computer Science 3+ years of experience in data analytics, preferably in a customer-facing role Strong analytical skills with experience in data analysis, data visualization, and reporting Experience with analyzing complex datasets using SQL Experience with data storytelling and building dashboards on business intelligence platforms such as Metabase or Looker Familiarity with our Analytics tech stack (dbt, BigQuery, Metabase) a plus Excellent communication and presentation skills, with the ability to explain technical concepts to non-technical stakeholders including Uscreen customers Strong problem-solving skills and attention to detail ✔️ Are you interested in applying? ✔️ Are you interested in applying? Fill out the short form We will review the applications and email candidates who qualify to set up a first-round interview Fill out the short form We will review the applications and email candidates who qualify to set up a first-round interview",4.5,1 to 50 Employees,2015,Company - Private,Enterprise Software & Network Solutions,Information Technology,Unknown / Non-Applicable
Remote,SQL Data Analyst,N/A,Futura Healthcare,Key responsibilities and tasks: 1. Data Extraction and Collection: 2. Data Cleansing and Transformation: 3. Database Management: 4. SQL Querying: 5. Data Analysis: 6. Performance Monitoring: 7. Predictive Modeling: 8. Healthcare Reporting: 9. Compliance and Privacy: 10. Collaboration: 11. Continuous Learning:,3.7,51 to 200 Employees,N/A,Company - Private,Computer Hardware Development,Information Technology,Unknown / Non-Applicable
