Location,Job Title,Salary Estimate,Employer Name,Job Description,Rating,Company Size,Founded,Type,Industry,Sector,Revenue
"North Little Rock, AR",Data Analyst,$51K - $77K (Glassdoor est.),First Orion,"First Orion is seeking a talented Data Analyst to join a leading mobile software vendor in the Data Solutions Group. This is a dynamic and diverse role requiring extensive analytical, data product and business skills applied through the execution of data including development and creation of data content for use in data products and solutions. These activities are typically product or solution based designed for use by many clients or the focus of a single client who requires custom research and data development to solve a specific business problem. What you'll be doing: Use data science tools and techniques to perform varied analyses to support business requirements, including scoring and predictive models, classification, data mining, clustering, and NLP techniques Implement data exploration to discover patterns, build new features for machine learning models, uncover gaps in the solution(s), and identify anomalies within the data warehouse(s) Generate visualizations using Scala/Python/SQL and create storyboards to communicate data insights, significant features, and model performance Build, own, and maintain Tableau and SQL dashboards for internal reporting and external, client-facing users Compile and prepare data from various sources by creating and managing ETL systems, Delta tables, and Databricks jobs for analyses and internal reporting Capture critical changes in production processes, manage data-driven alerts, and communicate findings with data engineering and data science teams Utilize Git for version control to manage own projects and collaborate with data engineers and data scientists Create metadata, data dictionaries, and Confluence pages for technical documentation Lead escalation analyses and prepare written reports for intra and inter-team senior management Assist in defining new data products or solutions for future business opportunities Use Agile/Scrum methodology for project planning and development What you'll need: Degree in Computer Science, Mathematics, Statistics, Physics, or Economics (strong econometrics focus) Experience in working with large datasets Programming experience in a language of your choice (Scala/Python/R preferred) High curiosity for data discovery Ability to perform verbal and visual storytelling with data Self-starter able to work independently with limited supervision. Strong verbal and written communication skills Bonus Points: Prior experience in the telecommunications industry Amazon Web Services experience Spark experience Knowledge about big data platforms Company Benefits: Balancing the work-life flow is key to health and happiness! That is why we offer one of the most competitive packages in our industry with open PTO, company paid holidays, Flex Fridays and flexible work arrangements. We strongly value the health and wellness of our teammates and through our state-of-the-art fitness center, full-time personal trainer on staff, and fitness classes (both in person and remote), we’re helping our teammates reach their wellness goals while at work. Add on generous health and dental/vision options, retirement plans, learning and development programs, career path frameworks, tuition reimbursement, company options and bonus potential you have many ways to take advantage of a comprehensive benefits package that means the most to you!  Learn More About First Orion: First Orion helps businesses generate more revenue, increase efficiency, and improve the customer experience by empowering them to brand their phone calls with their name, logo and reason for calling. We are the market leader in branded communications technology, and a trusted partner to Fortune 500 companies and the largest U.S. mobile carriers. First Orion has been voted a Great Place to Work with top rankings in every category. Learn more about what our employees have to say on our First Orion Glassdoor page and watch our People First Diversity Statement/Video . First Orion Culture Cornerstones are at the core of everything we do here.  Disclosure: First Orion is an Affirmative Action and Equal Opportunity Employer. This job description is not designed to cover or contain a comprehensive listing of activities, duties or responsibilities that are required of the employee for this job. Activities, duties and responsibilities may change at any time with or without notice, based on the changing needs of our business. At this time, we are not able to sponsor visas, such as H-1B, for this particular position. First Orion is interested in every qualified candidate who is eligible to work in the United States. First Orion’s immigration sponsorship policy is applied in a nondiscriminatory fashion regardless of race, gender, ethnic origin, or any other classification protected by law. First Orion is seeking a talented Data Analyst to join a leading mobile software vendor in the Data Solutions Group. This is a dynamic and diverse role requiring extensive analytical, data product and business skills applied through the execution of data including development and creation of data content for use in data products and solutions. These activities are typically product or solution based designed for use by many clients or the focus of a single client who requires custom research and data development to solve a specific business problem. What you'll be doing: Use data science tools and techniques to perform varied analyses to support business requirements, including scoring and predictive models, classification, data mining, clustering, and NLP techniques Implement data exploration to discover patterns, build new features for machine learning models, uncover gaps in the solution(s), and identify anomalies within the data warehouse(s) Generate visualizations using Scala/Python/SQL and create storyboards to communicate data insights, significant features, and model performance Build, own, and maintain Tableau and SQL dashboards for internal reporting and external, client-facing users Compile and prepare data from various sources by creating and managing ETL systems, Delta tables, and Databricks jobs for analyses and internal reporting Capture critical changes in production processes, manage data-driven alerts, and communicate findings with data engineering and data science teams Utilize Git for version control to manage own projects and collaborate with data engineers and data scientists Create metadata, data dictionaries, and Confluence pages for technical documentation Lead escalation analyses and prepare written reports for intra and inter-team senior management Assist in defining new data products or solutions for future business opportunities Use Agile/Scrum methodology for project planning and development Use data science tools and techniques to perform varied analyses to support business requirements, including scoring and predictive models, classification, data mining, clustering, and NLP techniques Implement data exploration to discover patterns, build new features for machine learning models, uncover gaps in the solution(s), and identify anomalies within the data warehouse(s) Generate visualizations using Scala/Python/SQL and create storyboards to communicate data insights, significant features, and model performance Build, own, and maintain Tableau and SQL dashboards for internal reporting and external, client-facing users Compile and prepare data from various sources by creating and managing ETL systems, Delta tables, and Databricks jobs for analyses and internal reporting Capture critical changes in production processes, manage data-driven alerts, and communicate findings with data engineering and data science teams Utilize Git for version control to manage own projects and collaborate with data engineers and data scientists Create metadata, data dictionaries, and Confluence pages for technical documentation Lead escalation analyses and prepare written reports for intra and inter-team senior management Assist in defining new data products or solutions for future business opportunities Use Agile/Scrum methodology for project planning and development What you'll need: Degree in Computer Science, Mathematics, Statistics, Physics, or Economics (strong econometrics focus) Experience in working with large datasets Programming experience in a language of your choice (Scala/Python/R preferred) High curiosity for data discovery Ability to perform verbal and visual storytelling with data Self-starter able to work independently with limited supervision. Strong verbal and written communication skills Degree in Computer Science, Mathematics, Statistics, Physics, or Economics (strong econometrics focus) Experience in working with large datasets Programming experience in a language of your choice (Scala/Python/R preferred) High curiosity for data discovery Ability to perform verbal and visual storytelling with data Self-starter able to work independently with limited supervision. Strong verbal and written communication skills Bonus Points: Prior experience in the telecommunications industry Amazon Web Services experience Spark experience Knowledge about big data platforms Prior experience in the telecommunications industry Amazon Web Services experience Spark experience Knowledge about big data platforms Company Benefits: Balancing the work-life flow is key to health and happiness! That is why we offer one of the most competitive packages in our industry with open PTO, company paid holidays, Flex Fridays and flexible work arrangements. We strongly value the health and wellness of our teammates and through our state-of-the-art fitness center, full-time personal trainer on staff, and fitness classes (both in person and remote), we’re helping our teammates reach their wellness goals while at work. Add on generous health and dental/vision options, retirement plans, learning and development programs, career path frameworks, tuition reimbursement, company options and bonus potential you have many ways to take advantage of a comprehensive benefits package that means the most to you! Learn More About First Orion: First Orion helps businesses generate more revenue, increase efficiency, and improve the customer experience by empowering them to brand their phone calls with their name, logo and reason for calling. We are the market leader in branded communications technology, and a trusted partner to Fortune 500 companies and the largest U.S. mobile carriers. First Orion has been voted a Great Place to Work with top rankings in every category. Learn more about what our employees have to say on our First Orion Glassdoor page and watch our People First Diversity Statement/Video . First Orion Culture Cornerstones are at the core of everything we do here. First Orion has been voted a Great Place to Work with top rankings in every category. Great Place to Work Learn more about what our employees have to say on our First Orion Glassdoor page and watch our People First Diversity Statement/Video . First Orion Glassdoor People First Diversity Statement/Video First Orion Culture Cornerstones are at the core of everything we do here. First Orion Culture Cornerstones Disclosure: First Orion is an Affirmative Action and Equal Opportunity Employer. This job description is not designed to cover or contain a comprehensive listing of activities, duties or responsibilities that are required of the employee for this job. Activities, duties and responsibilities may change at any time with or without notice, based on the changing needs of our business. At this time, we are not able to sponsor visas, such as H-1B, for this particular position. First Orion is interested in every qualified candidate who is eligible to work in the United States. First Orion’s immigration sponsorship policy is applied in a nondiscriminatory fashion regardless of race, gender, ethnic origin, or any other classification protected by law. .",4.5,201 to 500 Employees,2008,Company - Private,Enterprise Software & Network Solutions,Information Technology,Unknown / Non-Applicable
Remote,Data Analyst,$75K - $90K (Employer est.),Meritize,"About Us About Us Meritize is an education lender that uses an individual’s academic, military and work achievements to enhance credit evaluation and expand funding for skills-based education. The company’s proprietary merit-based lending program goes beyond traditional underwriting to leverage individual academic and experiential data, resulting in increased access to educational funding and improved outcomes. The Meritize platform promotes the growth and development of skills-based careers on behalf of students, educators and employers through innovative funding solutions, skills building programs and career success services. Key Responsibilities Key Responsibilities If you are looking to work alongside a team of highly energetic, passionate and driven people, then this opportunity may be for you. Reporting to the Chief Analytics Officer, here are the key things this Data Analyst will be doing: Process large-scale information for reporting and analytical initiatives Combine disparate data types and sources into production views and datasets Generate, and automate, timely and accurate business reports to support all lines of business Create and productionize data accuracy and consistency checks Identify risk and opportunity in the efficiency, accuracy, and consistency of data and reporting of the Company Process large-scale information for reporting and analytical initiatives Combine disparate data types and sources into production views and datasets Generate, and automate, timely and accurate business reports to support all lines of business Create and productionize data accuracy and consistency checks Identify risk and opportunity in the efficiency, accuracy, and consistency of data and reporting of the Company Qualifications Qualifications Working closely with the team, this person will meet the following requirements: 2-4 years’ experience in business or data analytics Experience working with data tools such as SQL, Python, and Excel Experience with data analytics, data modeling, and business automation tools Programming skills (SQL and Python), and knowledge of information systems (MySQL, Quicksight a plus) Prior ETL experience (Python-based) is preferred 2-4 years’ experience in business or data analytics Experience working with data tools such as SQL, Python, and Excel Experience with data analytics, data modeling, and business automation tools Programming skills (SQL and Python), and knowledge of information systems (MySQL, Quicksight a plus) Prior ETL experience (Python-based) is preferred Meritize is an Equal Opportunity Employer. Meritize is an Equal Opportunity Employer. Job Type: Full-time Pay: $75,000.00 - $90,000.00 per year Benefits: 401(k) Dental insurance Flexible spending account Health insurance Health savings account Life insurance Paid time off Parental leave Professional development assistance Vision insurance 401(k) Dental insurance Flexible spending account Health insurance Health savings account Life insurance Paid time off Parental leave Professional development assistance Vision insurance Experience level: 2 years 2 years Schedule: Monday to Friday Monday to Friday Experience: Data analytics: 2 years (Required) SQL: 2 years (Required) Python: 2 years (Required) Data analytics: 2 years (Required) SQL: 2 years (Required) Python: 2 years (Required) Work Location: Remote",4.8,51 to 200 Employees,2016,Company - Private,Banking & Lending,Financial Services,Unknown / Non-Applicable
